<?xml version="1.0" encoding="UTF-8" ?>
<xs:schema xmlns:xs="http://www.w3.org/2001/XMLSchema">
    <xs:element name="Users">
        <xs:complexType>
            <xs:sequence>
                <xs:element name="User" maxOccurs="unbounded">
                    <xs:complexType>
                        <xs:sequence>
                            <xs:element name="status" type="xs:string"/>
                            <xs:element name="login" type="xs:string"/>
                            <xs:element name="password" type="xs:string"/>
                        </xs:sequence>
                        <xs:attribute name="id" type="xs:int"/>
                    </xs:complexType>
                </xs:element>
            </xs:sequence>
        </xs:complexType>
    </xs:element>
</xs:schema>